{
  "$schema": "./roadmap-metadata.schema.json",
  "schemaVersion": 1,
  "roadmap": "docs/content-roadmap.md",
  "roadmapIds": [
    "P28-G1",
    "P28-G2",
    "P28-G3",
    "P28-G4",
    "P28-G5",
    "P28-G6",
    "P28-G7",
    "P28-G8",
    "P28-G9",
    "P28-H1",
    "P28-H2",
    "P28-H3",
    "P28-H4"
  ],
  "proofProfiles": {
    "p28-visual-standard": [
      {
        "id": "targeted-regressions",
        "kind": "test",
        "required": true,
        "description": "Run the narrow task-specific regressions needed to disprove the implementation before final verification."
      },
      {
        "id": "production-build",
        "kind": "build",
        "required": true,
        "description": "The production client build and packaged graphics checks pass.",
        "command": "npm run build:prod"
      },
      {
        "id": "flagship-capture",
        "kind": "review",
        "required": true,
        "description": "Deterministic Flagship visual evidence required by the roadmap item is captured and remains gameplay-readable."
      },
      {
        "id": "candidate-ci",
        "kind": "ci",
        "required": true,
        "description": "Repository-required final browser/CI gates pass on the exact candidate revision."
      },
      {
        "id": "verified-apk",
        "kind": "artifact",
        "required": true,
        "description": "The exact candidate produces the required verified Android APK artifact."
      }
    ],
    "p28-performance-standard": [
      {
        "id": "targeted-regressions",
        "kind": "test",
        "required": true,
        "description": "Run focused deterministic performance/recovery regressions for the changed runtime path."
      },
      {
        "id": "production-build",
        "kind": "build",
        "required": true,
        "description": "The production client build and packaged graphics checks pass.",
        "command": "npm run build:prod"
      },
      {
        "id": "runtime-cost-evidence",
        "kind": "invariant",
        "required": true,
        "description": "Repository-visible runtime evidence proves the requested adaptive transition or bounded expensive-work behavior without substituting emulator timing for physical-phone acceptance."
      },
      {
        "id": "candidate-ci",
        "kind": "ci",
        "required": true,
        "description": "Repository-required final browser/CI gates pass on the exact candidate revision."
      },
      {
        "id": "verified-apk",
        "kind": "artifact",
        "required": true,
        "description": "The exact candidate produces the required verified Android APK artifact."
      }
    ]
  },
  "rules": [
    {
      "prefix": "P28-P",
      "affectedDomains": [
        "graphics",
        "performance",
        "runtime",
        "refinery"
      ],
      "proofProfile": "p28-performance-standard"
    },
    {
      "prefix": "P28-C",
      "affectedDomains": [
        "graphics",
        "refinery",
        "assets"
      ],
      "proofProfile": "p28-visual-standard"
    },
    {
      "prefix": "P28-D",
      "affectedDomains": [
        "graphics",
        "characters",
        "assets",
        "combat-presentation"
      ],
      "proofProfile": "p28-visual-standard"
    },
    {
      "prefix": "P28-E",
      "affectedDomains": [
        "graphics",
        "refinery",
        "vfx",
        "lighting"
      ],
      "proofProfile": "p28-visual-standard"
    },
    {
      "prefix": "P28-F",
      "affectedDomains": [
        "graphics",
        "assets",
        "packaging",
        "performance"
      ],
      "proofProfile": "p28-visual-standard"
    },
    {
      "prefix": "P28-G",
      "affectedDomains": [
        "graphics",
        "location-presentation"
      ],
      "proofProfile": "p28-visual-standard"
    },
    {
      "prefix": "P28-H",
      "affectedDomains": [
        "graphics",
        "capstone-presentation"
      ],
      "proofProfile": "p28-visual-standard"
    }
  ],
  "overrides": {
    "P28-G1": {},
    "P28-G2": {},
    "P28-G3": {},
    "P28-G4": {},
    "P28-G5": {},
    "P28-G6": {},
    "P28-G7": {},
    "P28-G8": {},
    "P28-G9": {},
    "P28-H1": {},
    "P28-H2": {},
    "P28-H3": {},
    "P28-H4": {}
  }
}
